title,channel,upload_date,url
"If you ban abortion, you ban healthcare for women",MS NOW,2024-09-07T18:02:06Z,https://www.youtube.com/watch?v=Q35K5Hriqc0
Don’t believe this dangerous conspiracy theory about Black women and abortion,MS NOW,2024-09-22T18:32:04Z,https://www.youtube.com/watch?v=hFzpAI_BLM8
JD Vance calls abortion ban &#39;a victory&#39; following report on death of Georgia mother,MS NOW,2024-09-19T22:50:16Z,https://www.youtube.com/watch?v=dV1CzR9exO8
&#39;A piece of my womanhood was taken&#39;: Texas woman on ectopic pregnancy,MS NOW,2024-08-14T02:35:44Z,https://www.youtube.com/watch?v=bgHF09KZkeE
Abortion bans reduce women to breeding stocks– and that’s exactly the point,MS NOW,2024-09-15T19:26:30Z,https://www.youtube.com/watch?v=idWz7gP5CcM
‘This death was preventable’: Sen. Ossoff discusses chilling consequences of GA abortion ban,MS NOW,2024-09-17T03:05:19Z,https://www.youtube.com/watch?v=oej-tTtZGPQ
‘He is proud that women are dying?’: Harris blasts Trump for deadly Georgia abortion ban,MS NOW,2024-09-21T03:46:09Z,https://www.youtube.com/watch?v=ueae4Bb8tjk
Sen. Warren calls out Trump’s abortion hypocrisy,MS NOW,2024-08-31T21:44:30Z,https://www.youtube.com/watch?v=xTOOSQaWnQ8
Lawrence on Trump&#39;s deadly abortion ban: &#39;Women are dying. They got what they wanted.’,MS NOW,2024-09-18T03:48:47Z,https://www.youtube.com/watch?v=KMaHAI5tGUI
The ‘abortion after birth’ lie is as dangerous as it is ludicrous,MS NOW,2024-09-14T20:00:41Z,https://www.youtube.com/watch?v=4gdpbVp04vM
‘Explicit’ cruelty: inside Project 2025’s plans ‘to whiten America’,MS NOW,2024-08-25T19:02:27Z,https://www.youtube.com/watch?v=l28SQ2hJ3Bw
Harris to give first abortion speech in Georgia after death of two women,MS NOW,2024-09-19T20:40:02Z,https://www.youtube.com/watch?v=EEFm-CvO19o
&#39;Trump&#39;s abortion ban&#39;--nationwide?,MS NOW,2024-09-23T23:28:56Z,https://www.youtube.com/watch?v=cEcLETsGMso
How abortion bans are leading to preventable deaths,MS NOW,2024-09-17T20:46:20Z,https://www.youtube.com/watch?v=5D7yHOc8xZY
‘Tip of the iceberg’: Bans in states with abortion restrictions leading to preventable deaths,MS NOW,2024-09-18T01:06:26Z,https://www.youtube.com/watch?v=LXfg_FEuZkk
&#39;Really important&#39; for Harris to personalize abortion rights issue,MS NOW,2024-09-20T20:45:01Z,https://www.youtube.com/watch?v=7qdEPjQwTwo
Deaths under GA&#39;s strict abortion ban &#39;only the beginning&#39;,MS NOW,2024-09-23T10:12:57Z,https://www.youtube.com/watch?v=on9zmZQeIyg
Out-of-touch Republicans get shocking dose of reality in abortion stories,MS NOW,2024-09-14T05:11:44Z,https://www.youtube.com/watch?v=5AM8-ejjGz4
Treating abortion bans ‘as if they aren’t violence’ turns Black women into ‘collateral’,MS NOW,2024-09-22T18:39:50Z,https://www.youtube.com/watch?v=2hmK2u5svek
Rep. Jasmine Crockett: ‘We are all actually under attack’,MS NOW,2024-09-14T20:02:19Z,https://www.youtube.com/watch?v=UDM4oT2Cr_o
How Trump could lose to Harris: Abortion and Project 2025 dominate ,MS NOW,2024-08-12T20:02:55Z,https://www.youtube.com/watch?v=24MbgRDM1sc
"Vance: Trump would veto abortion ban, AG Nessel reacts and highlights Harris&#39; abortion rights plan",MS NOW,2024-08-25T18:22:55Z,https://www.youtube.com/watch?v=ja4OQGbZrZA
"VP Harris holds emotional event, after preventable death in Georgia as a result of abortion ban",MS NOW,2024-09-20T21:54:45Z,https://www.youtube.com/watch?v=_SVUZkwLBX8
Two stories of women who died because of repeal of Roe v. Wade,MS NOW,2024-09-19T02:24:35Z,https://www.youtube.com/watch?v=n9OiRAViJNs
Trump can&#39;t get out of his own way on abortion rights,MS NOW,2024-09-04T04:43:05Z,https://www.youtube.com/watch?v=WxH_HEMovq8
Indiana attorney general drops lawsuit over privacy of Ohio girl who traveled for abortion,MS NOW,2024-08-15T01:32:29Z,https://www.youtube.com/watch?v=Zipq90VVhsg
Two Texas women with dangerous pregnancies denied care,MS NOW,2024-08-14T14:51:44Z,https://www.youtube.com/watch?v=SHG1_CPz0Po
Abortion on the ballot: &#39;This is going to be front and center&#39;,MS NOW,2024-08-14T04:29:31Z,https://www.youtube.com/watch?v=I8Om8VSJNDE
&#39;Totally deteriorating&#39;: Trump &#39;desperate&#39; to find new voters as he backtracks abortion comments,MS NOW,2024-08-30T20:31:57Z,https://www.youtube.com/watch?v=68D684zR-Vs
Republican candidate caught telling women over 50 that abortion rights is &#39;not an issue for you&#39;,MS NOW,2024-09-24T04:59:15Z,https://www.youtube.com/watch?v=0UqnRIvXzrI
‘It is bizarre!’ Political analyst reacts to Trump trying to change the tune of his abortion stance,MS NOW,2024-08-31T19:28:49Z,https://www.youtube.com/watch?v=07a4k2U2dDQ
Georgia&#39;s abortion ban and deaths of two women were preventable: Jonathan Capehart,MS NOW,2024-09-22T15:59:51Z,https://www.youtube.com/watch?v=gY6OPTOaiMc
GOP efforts to downplay abortion care can’t conceal all the women bleeding in parking lots,MS NOW,2024-09-15T19:27:13Z,https://www.youtube.com/watch?v=p-TiykW2umk
"Rick Scott &#39;one of the most extreme senators&#39; on abortion, says his challenger",MS NOW,2024-09-04T13:03:35Z,https://www.youtube.com/watch?v=28MKWav7T1U
"Suburban women are &#39;single-issue voters&#39; on abortion, says Ohio GOP candidate",MS NOW,2024-09-25T11:58:02Z,https://www.youtube.com/watch?v=uOnTYGAwNak
House Republican vows to never support a national abortion ban,MS NOW,2024-09-10T18:21:00Z,https://www.youtube.com/watch?v=w8WyNrVjxKY
‘A Fundamental Right’: Arizona certifies abortion-rights initiative for the November ballot,MS NOW,2024-08-13T21:19:39Z,https://www.youtube.com/watch?v=YamJ5oPYiq4
Trump-Vance team &#39;panicking&#39; about abortion as Trump vows to be &#39;great&#39; for women: Dem strategist,MS NOW,2024-08-26T18:50:22Z,https://www.youtube.com/watch?v=iNMpxSmZwBs
JD Vance in 2021: Companies backing abortion rights really want &#39;cheap labor&#39;,MS NOW,2024-08-16T12:06:00Z,https://www.youtube.com/watch?v=wKcHK0DSfVs
How abortion rights could impact the election after deaths of two Georgia women,MS NOW,2024-09-20T16:36:12Z,https://www.youtube.com/watch?v=shWTO6FGPPg
"WATCH: Kamala Harris condemns Trump, focuses on reproductive rights at Georgia event",MS NOW,2024-09-20T19:47:29Z,https://www.youtube.com/watch?v=_msfsX0w6GI
‘In what world’ will women ‘stop thinking about abortion’? Planned Parenthood CEO reacts to Trump,MS NOW,2024-09-22T20:29:44Z,https://www.youtube.com/watch?v=RMpfPu0098Q
Abortion drugs and procedures are part of lifesaving treatments because abortion is healthcare,MS NOW,2024-09-21T20:06:43Z,https://www.youtube.com/watch?v=2bju4JCZwDY
‘Really frightening’: women waiting until near-death for reproductive care,MS NOW,2024-08-17T18:44:51Z,https://www.youtube.com/watch?v=ASJMja966UE
&#39;America has the receipts&#39;: Why voters won&#39;t buy Trump as reproductive rights champion,MS NOW,2024-08-27T04:40:14Z,https://www.youtube.com/watch?v=WWnibhado4c
"‘Voters are not stupid, especially women’: Abortion rallies women nationwide at the polls",MS NOW,2024-08-31T18:53:39Z,https://www.youtube.com/watch?v=X_uFA5L3C-8
DSCC Chairman Sen. Gary Peters: There is a chance Dems win senate race in FL,MS NOW,2024-08-21T18:03:39Z,https://www.youtube.com/watch?v=j7Bo1rj9jyw
Trump’s shocking IVF flip-flop: Desperate move &#39;to stay out of prison&#39;?,MS NOW,2024-08-31T01:50:31Z,https://www.youtube.com/watch?v=GBS-3Z6WRaQ
Sen. Warren: &#39;This is just creepy!&#39;,MS NOW,2024-09-25T17:30:34Z,https://www.youtube.com/watch?v=-wWvlgMG1b8
"Trump ditches 2025: See Corey Lewandowski talk abortion, RFK Jr. and vaccines with Ari Melber",MS NOW,2024-08-28T23:50:20Z,https://www.youtube.com/watch?v=cNs2ya1vtec
OB/GYN running for Congress in Wisconsin as Democrats campaign on abortion rights,MS NOW,2024-08-13T17:58:31Z,https://www.youtube.com/watch?v=hTiqINaZw6g
Choose wisely: Abortion is once again on the presidential election ballot,MS NOW,2024-08-31T18:46:45Z,https://www.youtube.com/watch?v=mBdJtvPgTcs
The ‘Jane Crow’ era: why the ‘abandonment of morality’ by SCOTUS is ‘a matter of democracy’,MS NOW,2024-08-24T18:26:35Z,https://www.youtube.com/watch?v=xVkvS_b7fNU
"‘Sorry, Donald. You can’t have it both ways:’ Warren blasts Trump&#39;s flip-flopping on IVF",MS NOW,2024-08-31T16:38:26Z,https://www.youtube.com/watch?v=bNCCmm-fLDs
"If Trump is elected, Christian conservatives laying groundwork to restrict access to abortion, IVF",MS NOW,2024-08-15T20:30:05Z,https://www.youtube.com/watch?v=iJL0fRLN_IU
&#39;No respect for women&#39;: Florida Dem Mucarsel-Powell blasts Republican men&#39;s abortion comments,MS NOW,2024-09-24T03:45:02Z,https://www.youtube.com/watch?v=nV9FYCHlqv4
&#39;We need to have Roe restored&#39;: Tester blasts GOP rival Sheehy who calls abortion &#39;sinful&#39;,MS NOW,2024-09-19T03:42:46Z,https://www.youtube.com/watch?v=nrG49_xaGaA
Kamala Harris blames Donald Trump for abortion bans,MS NOW,2024-09-21T04:30:16Z,https://www.youtube.com/watch?v=lEqWlkS6CbQ
Project 2025 seeks to resurrect a 151-yr-old law to subordinate women,MS NOW,2024-09-14T20:03:53Z,https://www.youtube.com/watch?v=xZAofihV1hM
‘I’m right here&#39;: Idaho woman destroys Trump advisor claiming Harris lied about abortion ban effects,MS NOW,2024-09-13T22:42:48Z,https://www.youtube.com/watch?v=uzcWTLFNtT0
Stacey Abrams shreds JD Vance for distorting her words,MS NOW,2024-08-16T05:26:21Z,https://www.youtube.com/watch?v=Jej4y_DJk3U
Trump leaving abortion rights up to the states &#39;hurting women across the country&#39;,MS NOW,2024-08-26T15:02:08Z,https://www.youtube.com/watch?v=QZ_UPgtYq9o
&quot;We know you&#39;re lying&quot;: Undecided voter&#39;s emotional response to Trump,MS NOW,2024-09-11T20:34:54Z,https://www.youtube.com/watch?v=SbEc0MpCCc0
Lawrence: Republican men who write abortion bans don&#39;t care about the life of the mother,MS NOW,2024-09-19T03:57:04Z,https://www.youtube.com/watch?v=0KPzuCgA1pI
Deaths of women who couldn’t get an abortion ‘should be on Trump’s conscience’: Sen. Duckworth,MS NOW,2024-09-17T18:15:14Z,https://www.youtube.com/watch?v=yBzpIIsjg9U
Peter Wehner: Pro-life justification for supporting the former president has collapsed,MS NOW,2024-08-28T15:10:11Z,https://www.youtube.com/watch?v=wZIMrCb5aN0
JD Vance says Trump would veto a national abortion ban; Dems aren&#39;t buying it,MS NOW,2024-08-26T00:34:03Z,https://www.youtube.com/watch?v=OHyH2InJZXk
Gov. Beshear: ‘JD Vance knows that he and Donald Trump are so wrong on’ abortion,MS NOW,2024-08-20T17:51:49Z,https://www.youtube.com/watch?v=7ByLiVs2BRg
Florida is ‘absolutely’ in play for the presidential race: FL Dem Party Chair Nikki Fried,MS NOW,2024-08-20T18:22:51Z,https://www.youtube.com/watch?v=k5wzRCDUQ5Q
Why every single person of reproductive age with a uterus is at risk,MS NOW,2024-08-17T18:41:06Z,https://www.youtube.com/watch?v=YSlrfrZvwhY
‘Only time’ that Trump cares about abortion is when it’s a swing state: former Rep. Comstock,MS NOW,2024-08-13T16:35:31Z,https://www.youtube.com/watch?v=C0nYarM99_k
‘A terrifying place to be’: Fmr. HHS Secretary warns about Project 2025’s plans for women&#39;s health,MS NOW,2024-08-25T19:02:58Z,https://www.youtube.com/watch?v=vMN1NzLrtD4
Gov. Beshear slams &#39;how extreme our laws have gotten&#39; around reproductive rights,MS NOW,2024-08-20T13:18:33Z,https://www.youtube.com/watch?v=bNteqyNSkn0
‘Predictable’ consequences of the post-Roe v. Wade era dig at Trump’s new promise to women,MS NOW,2024-09-22T16:01:01Z,https://www.youtube.com/watch?v=LVxO_sqOMzQ
"Trump riles parts of his base over abortion, Harris defends policy shifts",MS NOW,2024-08-30T17:40:45Z,https://www.youtube.com/watch?v=BtHi_yYvbdo
You cannot trust Trump on women&#39;s health: Gov. Whitmer blasts Trump&#39;s flip-flopping,MS NOW,2024-09-03T13:27:34Z,https://www.youtube.com/watch?v=OVljkEGZqhw
Hayes on JD Vance: &#39;It got weird&#39;,MS NOW,2024-08-16T03:15:02Z,https://www.youtube.com/watch?v=jdzOMWnporQ
Trump is now ‘multiple choice’ on abortion &amp; ‘in real trouble’ flip flopping,MS NOW,2024-09-02T21:00:23Z,https://www.youtube.com/watch?v=cBOoDkl_0dI
‘Insulting to the shoe flip-flops’: Nicolle Wallace on Trump’s embarrassingly weak abortion stance,MS NOW,2024-09-02T21:45:00Z,https://www.youtube.com/watch?v=3kp_PELaAfg
&#39;Women will have less health care&#39;: Governor warns of a second Trump term,MS NOW,2024-09-23T13:10:03Z,https://www.youtube.com/watch?v=wRwt1B3vsM0
"While losing the debate, Trump also lost Republican control of the &#39;family values&#39; narrative",MS NOW,2024-09-12T04:00:10Z,https://www.youtube.com/watch?v=M2HhZoDHEPo
&#39;Preventable&#39;: Harris talks with family devastated by deadly Georgia abortion ban,MS NOW,2024-09-20T03:52:25Z,https://www.youtube.com/watch?v=I72WZ6l_pH4
"‘We are not breeding stock’: In Post-Roe America, women sue for basic maternal care",MS NOW,2024-09-08T19:35:07Z,https://www.youtube.com/watch?v=5lKL0e3_cy0
Donald Trump chases politics and stabs evangelical supporters in the back,MS NOW,2024-08-31T03:01:12Z,https://www.youtube.com/watch?v=hw55Yyj2IAc
Shook: Trump unmoored as new &#39;purple wave’ rocks campaign amid Harris’ &#39;blue crush’,MS NOW,2024-08-14T00:30:19Z,https://www.youtube.com/watch?v=Dx6m7CKkGpY
Why Sen. Klobuchar is optimistic about Harris’ chances in Florida this election,MS NOW,2024-09-07T17:11:38Z,https://www.youtube.com/watch?v=tefLh42ZWAw
Democrats make a play for Senate in Trump’s home state of Florida,MS NOW,2024-09-19T17:42:06Z,https://www.youtube.com/watch?v=o8I0XMXLvSs
"Tensions erupt at White House press briefing over Springfield, Ohio",MS NOW,2024-09-13T19:41:46Z,https://www.youtube.com/watch?v=ncApLFnEIRU
Trump says he will vote against abortion rights in Florida,MS NOW,2024-08-30T22:56:16Z,https://www.youtube.com/watch?v=U6DsVKe66-k
‘What an embarrassment’: JD Vance describes his mother-in-law as postmenopausal caretaker,MS NOW,2024-08-15T22:15:00Z,https://www.youtube.com/watch?v=V70ymSPxW_8
Poll bombshells: Harris beats Trump on the economy — and could flip Florida?!,MS NOW,2024-09-17T03:46:49Z,https://www.youtube.com/watch?v=WHrK1sDf4pY
Sen. Laphonza Butler: Trump and Vance &#39;cannot be trusted&#39;,MS NOW,2024-08-26T00:32:27Z,https://www.youtube.com/watch?v=pMOkwPeANVg
‘This is really creepy’: Sen. Warren eviscerates Trump’s message to women voters,MS NOW,2024-09-25T01:08:20Z,https://www.youtube.com/watch?v=uWpOxxhfG1Q
Denial of reproductive freedoms is ‘creating chaos’ across the country: Rep. Angie Craig,MS NOW,2024-09-21T21:43:31Z,https://www.youtube.com/watch?v=_SHDlZfF2ew
How lawmakers are ‘turning a blind cold eye’ to horrors women face,MS NOW,2024-09-21T16:52:28Z,https://www.youtube.com/watch?v=R5IU0WZURa8
&#39;Women are dying because of this.&#39; Roe advocate Hadley Duvall joins forces with the Harris campaign,MS NOW,2024-09-19T04:41:09Z,https://www.youtube.com/watch?v=vnasbws_N7k
‘I have to fight back’: AL woman whose IVF procedure was blocked appears in new Harris campaign ad,MS NOW,2024-09-07T22:58:54Z,https://www.youtube.com/watch?v=sxy3SnzWbAo
JD Vance’s policy solution for child care is grandma and grandpa,MS NOW,2024-09-07T01:10:06Z,https://www.youtube.com/watch?v=47qGZiee1GI
&#39;Absolutely desperate&#39;: Joe on Trump &#39;moving all over the place&#39; on the issues,MS NOW,2024-09-03T11:24:43Z,https://www.youtube.com/watch?v=T8Bo-dprsoo
&#39;Beyond insulting&#39;: Mika reacts to Vance&#39;s suggestion women are not focused on reproductive rights,MS NOW,2024-08-15T10:56:01Z,https://www.youtube.com/watch?v=huRSS5h7rdk
&#39;Beyond insulting&#39;: Mika reacts to Vance&#39;s suggestion women are not focused on reproductive rights,MS NOW,2024-08-15T10:56:01Z,https://www.youtube.com/watch?v=huRSS5h7rdk
"Close race in battleground states, but trend lines looking good for Harris",MS NOW,2024-09-04T12:32:39Z,https://www.youtube.com/watch?v=A44BjCHIC3M
Trump&#39;s 2024 nightmare: Women voting surge could elect Harris,MS NOW,2024-09-02T22:45:00Z,https://www.youtube.com/watch?v=ABnRCH0-X1c
New poll reveals what matters most to women voters,MS NOW,2024-09-17T13:59:21Z,https://www.youtube.com/watch?v=bYHMjQR_F8U
Steph Curry: Endorsing Harris was an &#39;easy choice&#39;,MS NOW,2024-09-06T21:03:48Z,https://www.youtube.com/watch?v=GUg6ilg2_V8
‘Their plan is horrifying’: Warren blasts Trump&#39;s feigned ignorance on healthcare repeal,MS NOW,2024-09-17T03:00:27Z,https://www.youtube.com/watch?v=OXF4TRHR-bY
Countdown to the 2024 election: Day 63 | MSNBC Highlights,MS NOW,2024-09-03T03:00:09Z,https://www.youtube.com/watch?v=FiHr1F6gUbI
Strategist breaks down how Harris looks to ‘rise above the attacks’ on her racial identity,MS NOW,2024-08-31T20:28:45Z,https://www.youtube.com/watch?v=GoJI_RHbPUo
Watch the first Trump-Harris presidential debate in 3 minutes,MS NOW,2024-09-11T04:45:47Z,https://www.youtube.com/watch?v=BVlI0vcf5T8
Key primaries underway today that could impact who controls the House and Senate,MS NOW,2024-08-13T18:25:46Z,https://www.youtube.com/watch?v=bfLWrCteB3k
Democrats reclaim FREEDOM from Trump,MS NOW,2024-08-26T00:30:16Z,https://www.youtube.com/watch?v=1gyUYaDfS4M
Harris campaign hits JD Vance over his ‘weird’ politics,MS NOW,2024-08-16T01:05:43Z,https://www.youtube.com/watch?v=rE06h_Zxfjo
Mark Robinson ‘is a liability’ to Trump campaign ‘in so many ways’: political analyst,MS NOW,2024-09-21T21:48:15Z,https://www.youtube.com/watch?v=3VutekBWxvw
Harris can win this election &#39;without doubt&#39; the more appearances she makes: Kasich,MS NOW,2024-09-11T16:36:03Z,https://www.youtube.com/watch?v=e__xJy-SFqE
&#39;They&#39;re eating the pets&#39;: Trump pushes &#39;bonkers&#39; and baseless claim about migrants,MS NOW,2024-09-11T15:54:14Z,https://www.youtube.com/watch?v=EtkugrS7zjg
Down-ballot Republicans practically begging Trump to focus on actual issues,MS NOW,2024-08-15T05:04:21Z,https://www.youtube.com/watch?v=G1L5X-qYnnQ
Trump and MAGA Republicans trying to ‘undermine’ election system: Rep. Sherrill,MS NOW,2024-09-20T17:52:55Z,https://www.youtube.com/watch?v=UNgkIw1wAxI
&#39;Prosecute this man&#39;: What Harris needs to do in debate against Trump next week,MS NOW,2024-09-03T16:19:03Z,https://www.youtube.com/watch?v=EQVIQ7Kq0S8
Here&#39;s why Gen Z women voters are &#39;overwhelmingly leaning Left’,MS NOW,2024-09-04T14:02:32Z,https://www.youtube.com/watch?v=-opWqVCrvyc
Trump&#39;s election nightmare comes true as Harris eviscerates MAGA in historic DNC speech,MS NOW,2024-08-23T23:30:21Z,https://www.youtube.com/watch?v=8pYIUNW82XI
Can Democrats flip Texas Senate seat? Rep. Allred challenging Ted Cruz,MS NOW,2024-09-19T17:40:28Z,https://www.youtube.com/watch?v=uA43xlkRI_U
“So ready for the job”: America’s first Black woman senator on VP Harris,MS NOW,2024-08-23T15:44:22Z,https://www.youtube.com/watch?v=8CbOyHMThu8
Kornacki: Harris narrowly ahead of Trump nationally in new NBC News poll,MS NOW,2024-09-23T16:21:49Z,https://www.youtube.com/watch?v=fPXmjtC42m4
Trump stuck playing defense after week of damaging mistakes,MS NOW,2024-08-31T16:18:14Z,https://www.youtube.com/watch?v=ds833sawAPk
"&#39;Big, happy family&#39;: Kamala Harris&#39; acceptance speech meets ecstatic reception at DNC",MS NOW,2024-08-23T06:20:22Z,https://www.youtube.com/watch?v=cZX6wPTa0T4
