title,channel,upload_date,url
"Kamala Harris repeats lines from debate, interviews",Fox News,2024-09-18T15:50:39Z,https://www.youtube.com/watch?v=0xB-bz5BFZQ
Laura: Here are Kamala Harris&#39; ‘5 biggest lies’,Fox News,2024-09-12T14:00:52Z,https://www.youtube.com/watch?v=petsbG-UtUI
"&#39;So embarrassing&#39;: Jesse Watters reacts to Kamala Harris&#39; &#39;word salad,&#39; &#39;pander politics&#39;",Fox News,2024-09-18T23:15:01Z,https://www.youtube.com/watch?v=t6rUOgutYUQ
Sen. John Kennedy reacts to Kamala Harris&#39; interview: &#39;It was like a wolf promising to be a vegan&#39;,Fox News,2024-08-31T01:27:00Z,https://www.youtube.com/watch?v=96GK8PUEeig
Jesse Watters: Kamala Harris still looks &#39;completely lost&#39;,Fox News,2024-09-14T02:45:00Z,https://www.youtube.com/watch?v=KFEQq7_x_nk
Kamala Harris: Consider what Trump will do if we give him power again,Fox News,2024-08-25T06:00:13Z,https://www.youtube.com/watch?v=FKHEYUImU8A
‘Gutfeld!’ reacts to Kamala Harris&#39; CNN interview,Fox News,2024-08-31T03:45:00Z,https://www.youtube.com/watch?v=I4r6CwSWZnw
Kamala Harris offers rambling answer to Pennsylvania voter&#39;s concerns about high prices,Fox News,2024-09-20T20:25:38Z,https://www.youtube.com/watch?v=cWBS7BCm8Ig
JD Vance reacts to Kamala Harris&#39; CNN sit-down: This was &#39;pretty bizarre&#39;,Fox News,2024-08-30T14:00:06Z,https://www.youtube.com/watch?v=YsfIg2SgN5Q
"Sean Hannity: Kamala Harris is a far-left, radical Marxist",Fox News,2024-09-19T02:00:00Z,https://www.youtube.com/watch?v=03aLB7mao9Y
Kayleigh McEnany: This is Kamala Harris&#39; biggest mistake,Fox News,2024-09-05T17:00:14Z,https://www.youtube.com/watch?v=MEjWev0dW3o
Trump uses Kamala Harris’ own words against her,Fox News,2024-09-11T03:45:00Z,https://www.youtube.com/watch?v=D0vcdRvJj8o
Kamala Harris serves up another &#39;word salad&#39;: Faulkner,Fox News,2024-09-16T20:45:00Z,https://www.youtube.com/watch?v=Xrk28RCz7zg
Tulsi Gabbard: Kamala Harris is ‘lying through her teeth’,Fox News,2024-08-29T10:45:00Z,https://www.youtube.com/watch?v=8NEbzwdEjWg
‘The Five’: Bernie Sanders drops a bombshell about Kamala Harris,Fox News,2024-09-09T23:00:12Z,https://www.youtube.com/watch?v=D-xOQxAqCDo
Kamala Harris affirmed her support for Israel and called for the Palestinian&#39;s suffering to end,Fox News,2024-08-23T10:00:18Z,https://www.youtube.com/watch?v=M3AH4SyM9G4
John Kennedy: Kamala Harris is a card carrying member of the Democratic Party&#39;s &#39;loon wing&#39; #shorts,Fox News,2024-08-31T02:15:00Z,https://www.youtube.com/watch?v=7ZzP0y-nQyw
WATCH: Kamala Harris explains her changing policy positions,Fox News,2024-09-11T08:00:08Z,https://www.youtube.com/watch?v=DJeRawBCgWg
FRIES WITH THAT?: Kamala Harris&#39; McD&#39;s story raises questions,Fox News,2024-08-30T07:00:31Z,https://www.youtube.com/watch?v=_ZkQj4inA9I
Why vote for Trump? Why vote for Harris? Amazon&#39;s Alexa gives shockingly different answers.,Fox News,2024-09-03T21:46:25Z,https://www.youtube.com/watch?v=jbo1gkS3Okk
Ted Cruz: &#39;Unburdened&#39; is Kamala Harris&#39; catch phrase for lying to Americans,Fox News,2024-09-04T10:00:40Z,https://www.youtube.com/watch?v=bSr5SyMRkeM
Trump tells Harris to &quot;wake&quot; Biden up to close the border,Fox News,2024-09-11T04:28:06Z,https://www.youtube.com/watch?v=7w-puL9zFPs
"Victim claims Kamala Harris &#39;shielded,&#39; &#39;ignored&#39; requests to release names in child abuse files",Fox News,2024-08-25T12:00:01Z,https://www.youtube.com/watch?v=1tylX9KfjsI
Watch the moment Trump and Harris shake hands to begin the ABC News Presidential Debate,Fox News,2024-09-11T02:47:31Z,https://www.youtube.com/watch?v=RMwIg2WUrPE
Donald Trump: Kamala Harris &#39;hates Israel&#39;,Fox News,2024-09-11T07:15:00Z,https://www.youtube.com/watch?v=FziplU2FH_I
Trump on &#39;Gutfeld!&#39;: People will figure this out about Kamala Harris,Fox News,2024-09-23T03:00:07Z,https://www.youtube.com/watch?v=A_iiOh4iVZs
Sean Hannity: The mob is allowing Kamala Harris to get away with this,Fox News,2024-08-27T03:15:03Z,https://www.youtube.com/watch?v=bb1z1ZNAYQk
"Trump, Harris face off at the ABC News Presidential Debate",Fox News,2024-09-11T02:55:35Z,https://www.youtube.com/watch?v=4IGd0BrrXoI
&#39;Gutfeld!&#39;: Why was Kamala Harris talking about ‘lawns’?,Fox News,2024-09-23T01:00:00Z,https://www.youtube.com/watch?v=-Ze7Oynf2I0
White House asked whether Kamala Harris is &#39;progressive&#39;,Fox News,2024-09-09T19:16:22Z,https://www.youtube.com/watch?v=tEgcLioERjk
What would it mean for America if Kamala Harris becomes the first female president of the US?,Fox News,2024-08-21T23:40:39Z,https://www.youtube.com/watch?v=fhqpf_q-zPA
&#39;The Five&#39; reacts to the first Trump-Harris debate,Fox News,2024-09-11T22:45:02Z,https://www.youtube.com/watch?v=fgN3DZNHtFI
Greg Gutfeld on Kamala Harris&#39; Oprah interview: Everyone got an aneurysm #shorts,Fox News,2024-09-23T20:45:00Z,https://www.youtube.com/watch?v=C1o70TlC1JA
Vivek Ramaswamy: Kamala Harris is another &#39;cog in the system&#39;,Fox News,2024-09-04T03:00:23Z,https://www.youtube.com/watch?v=GT0EDSOo6LQ
Jesse Watters breaks down Vice President Kamala Harris&#39; &#39;credibility gap&#39;,Fox News,2024-08-20T01:10:10Z,https://www.youtube.com/watch?v=HZ2clvCdTdc
Kamala Harris talks but takes ‘no action’: Trump,Fox News,2024-08-23T04:01:02Z,https://www.youtube.com/watch?v=LiLCMFvELME
&#39;The Five&#39; reacts to Oprah&#39;s star-studded sit-down with Kamala Harris,Fox News,2024-09-20T22:08:08Z,https://www.youtube.com/watch?v=ugnA1ZQPWXM
Kamala Harris to unveil economic policy: &#39;Absolute socialism&#39;,Fox News,2024-08-16T14:00:46Z,https://www.youtube.com/watch?v=kS3J2gBH42k
Trump: I was going to send Kamala Harris a MAGA hat!,Fox News,2024-09-11T04:45:00Z,https://www.youtube.com/watch?v=8Af2ZnmxzJ8
Pete Hegseth: Kamala Harris couldn&#39;t answer the easiest question,Fox News,2024-08-31T00:38:07Z,https://www.youtube.com/watch?v=OxRw0Rf_70U
How is Kamala Harris’ debate prep going?: Greg Gutfeld,Fox News,2024-09-04T22:45:02Z,https://www.youtube.com/watch?v=fkU-CnAGEMk
NBC News corrects host&#39;s false claim about Kamala Harris,Fox News,2024-09-03T14:30:07Z,https://www.youtube.com/watch?v=GPvOlzukz8s
California sheriff rips Kamala Harris over the use of his image in a political ad,Fox News,2024-08-13T18:23:42Z,https://www.youtube.com/watch?v=TxQKE6dzqdQ
AOC lashes out after Teamsters refuse to endorse Kamala Harris,Fox News,2024-09-19T14:30:00Z,https://www.youtube.com/watch?v=0y_XvXj58Bo
Sean Hannity: Bad news for the Kamala Harris campaign,Fox News,2024-08-24T01:30:19Z,https://www.youtube.com/watch?v=dfEh_aZhzTU
Kamala Harris says everything while saying NOTHING: Lisa Boothe,Fox News,2024-09-20T19:45:01Z,https://www.youtube.com/watch?v=iZl-Pa308rY
Trump says Taylor Swift will &#39;pay a price&#39; for endorsing Kamala Harris,Fox News,2024-09-11T15:30:07Z,https://www.youtube.com/watch?v=GAW4HFD86rE
Byron Donalds: This is the beginning of the end of Kamala Harris’ campaign,Fox News,2024-09-01T06:00:26Z,https://www.youtube.com/watch?v=cae2aDLl888
Trump: Kamala Harris is &#39;the worst vice president in history&#39;,Fox News,2024-09-11T04:00:30Z,https://www.youtube.com/watch?v=YRM4P-VUkEs
Body language expert says Kamala Harris lacked confidence and presidential appearance in interview,Fox News,2024-08-30T22:18:19Z,https://www.youtube.com/watch?v=oTL26x_L710
"Kamala Harris: Walz and I are both gun owners, we’re not taking anyone’s guns away",Fox News,2024-09-11T09:00:32Z,https://www.youtube.com/watch?v=QtEcV9uCSrU
&#39;Shark Tank&#39; star Kevin O&#39;Leary says Kamala Harris’ price fixing plan is &quot;beyond crazy.&quot;,Fox News,2024-08-20T13:13:13Z,https://www.youtube.com/watch?v=QVw_YFm5KzQ
"Kamala Harris didn’t get fact-checked a single time: RFK, Jr.",Fox News,2024-09-11T06:45:01Z,https://www.youtube.com/watch?v=KmP4pgzbbOc
VP Kamala Harris called out for &quot;cringe&quot; Southern accent at rally,Fox News,2024-09-03T21:16:52Z,https://www.youtube.com/watch?v=y_2KWWPpUQk
Trump says there won&#39;t be another debate with Kamala Harris,Fox News,2024-09-16T06:30:08Z,https://www.youtube.com/watch?v=Lx3gSNScFJA
‘The Five’: Kamala Harris has some explaining to do,Fox News,2024-08-28T22:15:00Z,https://www.youtube.com/watch?v=-hI1dSpHs8Q
&#39;More whiplash&#39;: Kamala Harris under fire for new backtrack,Fox News,2024-08-28T20:45:00Z,https://www.youtube.com/watch?v=E5i5ZIXLtbQ
Jesse Watters: We still have no idea if Kamala Harris made a McFlurry #shorts,Fox News,2024-09-04T20:15:01Z,https://www.youtube.com/watch?v=KRJ7UQYoaR0
Bret Baier on Kamala Harris&#39; strategy to avoid the press,Fox News,2024-08-22T00:20:23Z,https://www.youtube.com/watch?v=byNDK5_G0DA
Trump on Kamala Harris’ economic positions: &#39;She is Biden&#39;,Fox News,2024-09-11T05:30:08Z,https://www.youtube.com/watch?v=KSOPkgxnDlk
&#39;Jesse Watters Primetime&#39; asks: Why do you like Kamala Harris? #shorts,Fox News,2024-08-22T23:45:05Z,https://www.youtube.com/watch?v=wUwut7oSPtI
Where was Kamala Harris working the past 4 years?: Gutfeld,Fox News,2024-09-25T23:45:00Z,https://www.youtube.com/watch?v=g2JIK8iEfuE
&#39;Gutfeld!&#39;: Is Alexa biased towards Kamala Harris?,Fox News,2024-09-05T11:15:02Z,https://www.youtube.com/watch?v=VOudZ3VBftE
Charles Payne warns a Kamala Harris victory would mean a &#39;bifurcated economy&#39;,Fox News,2024-09-22T06:00:29Z,https://www.youtube.com/watch?v=yW6GyAo9SG4
Vice President Kamala Harris and Tim Walz conducted an interview... with themselves,Fox News,2024-08-15T23:43:33Z,https://www.youtube.com/watch?v=KhYzqbMXsag
RNC chairman: This is the question Kamala Harris needs to be asked,Fox News,2024-08-18T21:15:00Z,https://www.youtube.com/watch?v=idBXI-xp09E
This is the most &#39;pivotal&#39; moment yet for Kamala Harris: Concha,Fox News,2024-09-10T16:00:07Z,https://www.youtube.com/watch?v=5cpgPXpXugI
I don&#39;t think Kamala Harris could pull this off: Gasparino,Fox News,2024-09-22T17:15:00Z,https://www.youtube.com/watch?v=Bi3dh-_RO54
Donald Trump: I was going to send Kamala Harris a MAGA hat! #shorts,Fox News,2024-09-11T03:30:23Z,https://www.youtube.com/watch?v=Y6MgbfLreFs
&#39;Jesse Watters Primetime&#39; asks: Does Kamala Harris owe anyone an apology?,Fox News,2024-09-07T00:45:19Z,https://www.youtube.com/watch?v=y1Q9vuOfEfw
Kamala Harris: Our country needs a leader to address the problems at hand,Fox News,2024-09-11T03:30:15Z,https://www.youtube.com/watch?v=UMdIwUyFrnw
CNN pollster warns Kamala cannot &#39;take this for granted&#39;,Fox News,2024-08-15T20:30:02Z,https://www.youtube.com/watch?v=Vve9fuvAtR0
Kamala Harris is &#39;failing up&#39;: Rep. Cammack,Fox News,2024-08-30T18:15:01Z,https://www.youtube.com/watch?v=JbuBpiNjeFQ
Kamala Harris unveils economic plan: Together we will build an opportunity economy,Fox News,2024-08-16T21:30:03Z,https://www.youtube.com/watch?v=Uy_3tec_rYY
BRING PEOPLE TOGETHER: Kamala Harris teases appointing a Republican to her cabinet if elected,Fox News,2024-08-31T18:30:30Z,https://www.youtube.com/watch?v=RGSjUfZ64_s
Kamala Harris is ‘flip-flopping’ on everything: Tom Homan,Fox News,2024-08-28T07:00:28Z,https://www.youtube.com/watch?v=kRinnrvN4Hg
Ted Cruz: Day 1 for Kamala Harris was 4 years ago,Fox News,2024-08-27T06:15:00Z,https://www.youtube.com/watch?v=94ynS6aCbYc
This is my big question for Kamala Harris: Faulkner,Fox News,2024-09-18T18:00:29Z,https://www.youtube.com/watch?v=uVPgdNTlZV4
Jesse Watters: How long can the media keep the Harris campaign levitating?,Fox News,2024-09-25T01:00:21Z,https://www.youtube.com/watch?v=JH3HgyonU4I
Newsom laughs off process of Kamala Harris’ nomination #shorts,Fox News,2024-08-24T18:15:03Z,https://www.youtube.com/watch?v=r2zbcK5BB64
WATCH: Kamala Harris uses strikingly similar language in interview and debate,Fox News,2024-09-15T02:00:03Z,https://www.youtube.com/watch?v=6md4Z1_s5Ik
Kamala Harris is &#39;intentionally laying low&#39;: Mollie Hemingway,Fox News,2024-09-08T04:00:04Z,https://www.youtube.com/watch?v=9YPuS7bZUuI
Tulsi Gabbard: Kamala&#39;s campaign handlers are worried,Fox News,2024-08-15T16:45:00Z,https://www.youtube.com/watch?v=MNE-CuEA0Bc
&#39;The Five&#39;: Kamala Harris just got humiliated by Teamsters,Fox News,2024-09-19T23:15:02Z,https://www.youtube.com/watch?v=V2Hg9QgAQC0
Kamala Harris pressed on whether economy is better off than 4 years ago,Fox News,2024-09-11T02:57:42Z,https://www.youtube.com/watch?v=lHjx4_Ajtbg
Kamala Harris to skip major event for presidential candidates,Fox News,2024-09-23T17:45:00Z,https://www.youtube.com/watch?v=Ccsqvpm28JU
Greg Gutfeld: Joe asked Kamala to pull his finger #shorts,Fox News,2024-08-19T23:45:00Z,https://www.youtube.com/watch?v=-1l5f84l9Wo
What is Kamala Harris’ agenda?,Fox News,2024-09-06T05:15:00Z,https://www.youtube.com/watch?v=M2d58ketUCE
Tulsi Gabbard: Kamala Harris cannot run away from this,Fox News,2024-09-09T13:45:02Z,https://www.youtube.com/watch?v=DJ4aBaMZRXA
Greg Gutfeld: The same agents protecting Kamala Harris from reporters will protect Trump,Fox News,2024-09-19T02:15:01Z,https://www.youtube.com/watch?v=V1uJtW64w9s
Oprah&#39;s interview with Kamala Harris felt &#39;extremely out-of-touch&#39;: Ex–Democratic fundraiser,Fox News,2024-09-21T05:15:00Z,https://www.youtube.com/watch?v=G6cdfV5-DPs
Kevin O&#39;Leary: Kamala Harris&#39; economic policy is &#39;UNAMERICAN&#39;,Fox News,2024-08-30T09:00:18Z,https://www.youtube.com/watch?v=MvoYpJ0in0g
Hosts perplexed after VP Harris&#39; &#39;tedious&#39; Oprah event,Fox News,2024-09-20T13:01:10Z,https://www.youtube.com/watch?v=x9rVbDfRJ1g
Jesse Watters: Kamala just made the biggest mistake of her campaign,Fox News,2024-08-19T01:15:01Z,https://www.youtube.com/watch?v=P1D5GjDYGTI
Jesse Watters: Imagine this for four years #shorts,Fox News,2024-08-30T00:15:02Z,https://www.youtube.com/watch?v=VmLPI9fuT6k
This is Kamala Harris’ ‘kryptonite’: Hugh Hewitt,Fox News,2024-09-02T09:00:14Z,https://www.youtube.com/watch?v=AoOkPKHJSmo
Doocy: Kamala Harris has some explaining to do,Fox News,2024-09-10T15:15:00Z,https://www.youtube.com/watch?v=07QQrAEOOSg
Harris campaign facing bombshell ethics allegations,Fox News,2024-08-29T16:15:02Z,https://www.youtube.com/watch?v=m1_haeZT_ko
"Greg Gutfeld: As a former football coach, Walz will know when to take Harris out #shorts",Fox News,2024-08-30T00:45:03Z,https://www.youtube.com/watch?v=qZadsAmgNoY
Kamala Harris accused of looking for &#39;escape hatch&#39; from Trump debate,Fox News,2024-09-02T15:00:21Z,https://www.youtube.com/watch?v=KNNMl53k860
James Carville appears to want VP Kamala Harris to field &#39;planted&#39; questions,Fox News,2024-09-15T04:00:02Z,https://www.youtube.com/watch?v=ab0CsZhqWOU
Kevin O&#39;Leary blasts Kamala Harris’ price fixing plan and warns that it would lead to hyperinflation,Fox News,2024-08-23T21:30:42Z,https://www.youtube.com/watch?v=1ZELYScefGQ
Kamala Harris accused of looking for &#39;escape hatch&#39; from Trump debate,Fox News,2024-09-02T15:00:21Z,https://www.youtube.com/watch?v=KNNMl53k860
Kamala Harris warns that a Trump presidency would set the country back in DNC speech,Fox News,2024-08-23T04:30:24Z,https://www.youtube.com/watch?v=er1c4M90r8U
"Kamala Harris on Israel, Gaza: ‘The scale of suffering is heartbreaking’",Fox News,2024-08-24T04:00:26Z,https://www.youtube.com/watch?v=RJnuPepXRlQ
Newsom laughs off process of Kamala Harris’ nomination #shorts,Fox News,2024-08-24T18:15:03Z,https://www.youtube.com/watch?v=r2zbcK5BB64
Tulsi Gabbard: Trump will expose the truth about Harris,Fox News,2024-08-28T14:00:06Z,https://www.youtube.com/watch?v=6pxdHAeuvh8
Greg Gutfeld: The same agents protecting Kamala Harris from reporters will protect Trump,Fox News,2024-09-19T02:15:01Z,https://www.youtube.com/watch?v=V1uJtW64w9s
Jesse Watters: How long can the media keep the Harris campaign levitating?,Fox News,2024-09-25T01:00:21Z,https://www.youtube.com/watch?v=JH3HgyonU4I
Jesse Watters: Imagine this for four years #shorts,Fox News,2024-08-30T00:15:02Z,https://www.youtube.com/watch?v=VmLPI9fuT6k
"Kamala Harris: Joe, your character is inspiring",Fox News,2024-08-23T02:54:33Z,https://www.youtube.com/watch?v=Sl0w1pWj_cY
Tulsi Gabbard: Kamala&#39;s campaign handlers are worried,Fox News,2024-08-15T16:45:00Z,https://www.youtube.com/watch?v=MNE-CuEA0Bc
Sen. Chris Coons: Kamala Harris presented a &#39;positive and forward-looking agenda&#39;,Fox News,2024-09-12T06:00:14Z,https://www.youtube.com/watch?v=ixeXfbywQIY
Kamala Harris ‘knows us’: Gov. Gretchen Whitmer,Fox News,2024-08-26T03:15:05Z,https://www.youtube.com/watch?v=ynNZUg5EKzM
"RFK, Jr: Kamala Harris never answered this question",Fox News,2024-09-11T22:15:01Z,https://www.youtube.com/watch?v=oX4qySRpdqE
&#39;Jesse Watters Primetime&#39; asks Italians how they feel about Kamala Harris #shorts,Fox News,2024-09-18T02:15:05Z,https://www.youtube.com/watch?v=rspQoPqbooc
Sen. Manchin refuses to endorse Kamala Harris over controversial policy position,Fox News,2024-09-25T13:45:00Z,https://www.youtube.com/watch?v=7SVhnwqjEIs
Hosts perplexed after VP Harris&#39; &#39;tedious&#39; Oprah event,Fox News,2024-09-20T13:01:10Z,https://www.youtube.com/watch?v=x9rVbDfRJ1g
Newt Gingrich: Kamala Harris is beginning to ‘crumble’,Fox News,2024-09-04T08:30:27Z,https://www.youtube.com/watch?v=wFK5z74ipw4
Gold Star families defend Trump after Harris&#39; criticism,Fox News,2024-09-01T16:15:03Z,https://www.youtube.com/watch?v=qgLfB6Db7X0
Gad Saad: Kamala Harris will try to ‘hijack’ your emotional system,Fox News,2024-09-06T09:15:00Z,https://www.youtube.com/watch?v=Ba0jhE3Z1us
The media is doing &#39;all the work&#39; for Kamala Harris: Tomi Lahren,Fox News,2024-08-13T13:30:27Z,https://www.youtube.com/watch?v=yky2sSUi4l0
Democrats try to defend Kamala Harris&#39; &#39;flip-flops&#39;: &#39;Sign of a good leader&#39;,Fox News,2024-09-02T13:00:35Z,https://www.youtube.com/watch?v=Y4Kim6AanFo
Corey Lewandowski: People don’t know who Kamala Harris is,Fox News,2024-09-09T21:45:01Z,https://www.youtube.com/watch?v=dqJY7TaKJ1s
Kamala Harris&#39; &#39;far-left&#39; policies will be &#39;THE ISSUE THAT SINKS HER in this race&#39;: Ari Fleischer,Fox News,2024-08-19T05:00:02Z,https://www.youtube.com/watch?v=6nTB21ODhZc
WATCH: Kamala Harris backtracks on key policy issues,Fox News,2024-08-13T23:00:08Z,https://www.youtube.com/watch?v=IIMjt9YqnnI
‘The Five’: Kamala Harris’ comments come back to haunt her,Fox News,2024-08-26T23:30:06Z,https://www.youtube.com/watch?v=RD5de1vYiSg
"Harris wants to resurrect the most disastrous economic policy, Asman says",Fox News,2024-08-17T12:45:01Z,https://www.youtube.com/watch?v=JGvq7j5esTo
"Kamala Harris called out for &#39;sexist, misogynist&#39; campaign",Fox News,2024-08-27T16:30:18Z,https://www.youtube.com/watch?v=pVa6xp9nAuE
Trump slams Kamala over lack of interviews #shorts,Fox News,2024-08-18T23:00:01Z,https://www.youtube.com/watch?v=2RRLbRmJTKg
&#39;The Five&#39;: Trump creates policy website for Kamala Harris,Fox News,2024-08-22T23:01:44Z,https://www.youtube.com/watch?v=qxyzZfWAXUM
I’m not on the Kamala Harris ‘sugar high’ like everyone else: Dem Rep,Fox News,2024-08-18T19:45:00Z,https://www.youtube.com/watch?v=raFYaOi0AD8
Resurfaced videos show Kamala Harris previously supported abolishing private insurance,Fox News,2024-08-13T19:45:00Z,https://www.youtube.com/watch?v=CzbNiYJm8vk
Voter issues chilling warning on Kamala Harris&#39; border policies: &#39;Waiting for the next 9/11&#39;,Fox News,2024-09-24T19:00:06Z,https://www.youtube.com/watch?v=AdbyuaFo3lQ
"Trump rips Harris for not having a plan to improve the US economy: “Run, Spot, Run”",Fox News,2024-09-11T03:49:56Z,https://www.youtube.com/watch?v=yDvtdMMxP4o
This is not the true Kamala Harris: Sen. Tom Cotton,Fox News,2024-08-29T17:45:03Z,https://www.youtube.com/watch?v=mekuCuSrj_E
Judge Jeanine: Kamala Harris will no longer be in hiding,Fox News,2024-08-27T23:15:00Z,https://www.youtube.com/watch?v=aA1e3PWHshQ
Sean Hannity: This is the problem with Kamala Harris #shorts,Fox News,2024-09-25T21:15:00Z,https://www.youtube.com/watch?v=BX6b8lxXlm0
Kamala Harris TORCHED for &#39;incoherent&#39; sit-down interview,Fox News,2024-08-30T11:30:24Z,https://www.youtube.com/watch?v=RK5re19Q6Wo
"RFK, Jr.: Kamala Harris is very vulnerable on this",Fox News,2024-09-05T09:00:18Z,https://www.youtube.com/watch?v=HLvQxlInHVY
"The press is giving Kamala Harris a free ride, Trump campaign official warns",Fox News,2024-08-14T16:15:00Z,https://www.youtube.com/watch?v=DNrk_5oUUac
Harris mocked for repeating same answer: &#39;This is not a plan!&#39;,Fox News,2024-09-18T21:00:29Z,https://www.youtube.com/watch?v=XZN2H9tEux4
Gold Star families fire back at Kamala Harris over Trump&#39;s Arlington visit,Fox News,2024-09-03T16:45:02Z,https://www.youtube.com/watch?v=l5nqHijTo6c
Jesse Watters: This is the ‘biggest speech of Kamala’s life’ and she’s ‘freaking out’,Fox News,2024-08-23T01:45:01Z,https://www.youtube.com/watch?v=Io5V8uSxR5s
Kamala Harris finally agrees to sit-down interview,Fox News,2024-08-28T11:01:30Z,https://www.youtube.com/watch?v=kaMH4uNE9Ik
Kamala Harris &#39;CAN&#39;T BE TRUSTED&#39;: Lara Trump,Fox News,2024-08-19T08:45:00Z,https://www.youtube.com/watch?v=9_sAQ4WjRoo
McEnany: This is how Trump can end Kamala Harris&#39; career,Fox News,2024-09-10T13:45:02Z,https://www.youtube.com/watch?v=IT3mssVWKnA
Gold Star dad slams Kamala Harris on anniversary of Abbey Gate attack,Fox News,2024-08-26T18:30:56Z,https://www.youtube.com/watch?v=lzJtekc5a-0
Trump: People don&#39;t know who Kamala Harris is - she will be a terrible president,Fox News,2024-08-15T23:30:18Z,https://www.youtube.com/watch?v=lo-8GUOyxRs
Chris Sununu: Kamala Harris can’t get away from this,Fox News,2024-09-05T22:45:07Z,https://www.youtube.com/watch?v=LBCeb-zqpeo
Chris Sununu: Kamala Harris can’t get away from this,Fox News,2024-09-05T22:45:07Z,https://www.youtube.com/watch?v=LBCeb-zqpeo
Trump: People don&#39;t know who Kamala Harris is - she will be a terrible president,Fox News,2024-08-15T23:30:18Z,https://www.youtube.com/watch?v=lo-8GUOyxRs
Jon Favreau: People are pretty excited about Kamala Harris,Fox News,2024-08-23T06:45:00Z,https://www.youtube.com/watch?v=QEDqaPSMwKs
Kamala Harris is a fake: Rep. Waltz,Fox News,2024-08-12T19:45:00Z,https://www.youtube.com/watch?v=DZoHjnRJoLY
"Harris wants to resurrect the most disastrous economic policy, Asman says",Fox News,2024-08-17T12:45:01Z,https://www.youtube.com/watch?v=JGvq7j5esTo
Jesse Watters: This is the ‘biggest speech of Kamala’s life’ and she’s ‘freaking out’,Fox News,2024-08-23T01:45:01Z,https://www.youtube.com/watch?v=Io5V8uSxR5s
‘COPYCAT KAMALA’: Harris rips off one of Trump’s campaign proposals,Fox News,2024-08-12T01:45:00Z,https://www.youtube.com/watch?v=NvZEFsZmhvM
This is not the true Kamala Harris: Sen. Tom Cotton,Fox News,2024-08-29T17:45:03Z,https://www.youtube.com/watch?v=mekuCuSrj_E
CNN anchor criticized for &#39;wiffleball&#39; questions to Kamala Harris,Fox News,2024-08-30T20:15:03Z,https://www.youtube.com/watch?v=bMa6-BGGt18
Mike Huckabee: Kamala Harris doesn’t want people to find this out,Fox News,2024-08-19T10:00:32Z,https://www.youtube.com/watch?v=RXPL14SJ7jE
Voter issues chilling warning on Kamala Harris&#39; border policies: &#39;Waiting for the next 9/11&#39;,Fox News,2024-09-24T19:00:06Z,https://www.youtube.com/watch?v=AdbyuaFo3lQ
Taxes will rise if Kamala Harris becomes president: David Asman,Fox News,2024-09-07T11:00:11Z,https://www.youtube.com/watch?v=9QCsa1M_iio
America will see Kamala Harris run away from her past policies: Dr. Ben Carson,Fox News,2024-09-08T20:30:01Z,https://www.youtube.com/watch?v=R8kCw9CkDYI
Jesse Watters: Trump shows up in Kamala Harris&#39; backyard,Fox News,2024-09-13T23:03:06Z,https://www.youtube.com/watch?v=s2rTZ_MTH6M
Trump team trolls Kamala Harris with &#39;campaign&#39; website,Fox News,2024-08-22T15:45:04Z,https://www.youtube.com/watch?v=zmmObgpIfg4
JD Vance: This is the lie at the heart of Kamala Harris&#39; campaign,Fox News,2024-09-04T00:00:06Z,https://www.youtube.com/watch?v=UqX5EPj_e7g
Cavuto presses Kamala Harris adviser: Could you please answer the question?,Fox News,2024-08-23T05:15:00Z,https://www.youtube.com/watch?v=eWB8lEMpxpQ
Kamala Harris &#39;CAN&#39;T BE TRUSTED&#39;: Lara Trump,Fox News,2024-08-19T08:45:00Z,https://www.youtube.com/watch?v=9_sAQ4WjRoo
Democratic lawmaker argues Kamala Harris isn’t for banning fracking on private land,Fox News,2024-08-22T06:30:28Z,https://www.youtube.com/watch?v=f_WUjqnBFiA
Eric Trump rips VP Kamala Harris for not taking a stand on issues he says Americans are facing today,Fox News,2024-08-21T13:30:27Z,https://www.youtube.com/watch?v=ad3s58v4qmk
Democrat accuses campaign for ‘cocooning’ Kamala Harris: This is ‘red meat’ for GOP,Fox News,2024-09-02T20:00:18Z,https://www.youtube.com/watch?v=kNiuxYmsD3Q
Kamala Harris hasn&#39;t defended any positions: RNC chair,Fox News,2024-08-29T13:15:01Z,https://www.youtube.com/watch?v=DHiNxhKyuYM
Kamala Harris TORCHED for &#39;incoherent&#39; sit-down interview,Fox News,2024-08-30T11:30:24Z,https://www.youtube.com/watch?v=RK5re19Q6Wo
Laura: The Biden-Harris admin drove up inflation,Fox News,2024-08-17T02:45:00Z,https://www.youtube.com/watch?v=BroOLnGFcL4
Gold Star dad slams Kamala Harris on anniversary of Abbey Gate attack,Fox News,2024-08-26T18:30:56Z,https://www.youtube.com/watch?v=lzJtekc5a-0
Bernie Sanders is absolutely &#39;destroying&#39; Kamala Harris&#39; campaign: Charlie Hurt,Fox News,2024-09-09T16:00:26Z,https://www.youtube.com/watch?v=IebvbOQm5n0
Kamala Harris on Georgia high school shooting: This is a senseless tragedy,Fox News,2024-09-04T19:28:40Z,https://www.youtube.com/watch?v=r7cIWktqgT8
Kamala Harris: This campaign is born out of love of country,Fox News,2024-08-19T00:15:00Z,https://www.youtube.com/watch?v=819kwecRcgg
