title,channel,upload_date,url
Doug wishes Kamala Happy 10th anniversary,MS NOW,2024-08-22T19:48:39Z,https://www.youtube.com/watch?v=J2ysHdp-Ims
Harris and Trump meet for first time,MS NOW,2024-09-11T01:22:39Z,https://www.youtube.com/watch?v=yftACd_hE0o
Shocker: Bush VP Dick Cheney backs Kamala Harris,MS NOW,2024-09-06T23:45:40Z,https://www.youtube.com/watch?v=jMBk2ANJdMc
Pelosi slams Trump&#39;s attacks on VP Harris,MS NOW,2024-08-13T02:13:43Z,https://www.youtube.com/watch?v=ywnm1KfFvyM
She &#39;spanked his a**&#39;: Kamala Harris &#39;owns&#39; Donald Trump in first debate,MS NOW,2024-09-11T20:44:54Z,https://www.youtube.com/watch?v=bFMNPwyqkK4
Taylor Swift endorses Kamala Harris: See Tim Walz react live,MS NOW,2024-09-11T05:31:57Z,https://www.youtube.com/watch?v=lMcbJlidTCA
Harris: &#39;If someone breaks into my house...they&#39;re getting shot.&#39;,MS NOW,2024-09-20T18:39:00Z,https://www.youtube.com/watch?v=nuQCfpvrDWs
Stand-in for Trump in Harris debate prep shares what it like to get VP ready,MS NOW,2024-09-12T18:03:21Z,https://www.youtube.com/watch?v=XHT4OQPKO24
Professor on iconic photo of Kamala Harris&#39; niece,MS NOW,2024-08-26T23:30:06Z,https://www.youtube.com/watch?v=V1TV_WHypiA
Billie Eilish endorses Kamala Harris,MS NOW,2024-09-17T23:55:56Z,https://www.youtube.com/watch?v=y1Y-HNZnxKM
Kamala Harris responds to Trump’s claim she changed races,MS NOW,2024-08-30T02:49:53Z,https://www.youtube.com/watch?v=ZhLXfshXShA
Harris ROASTS Trump at debate,MS NOW,2024-09-11T05:18:18Z,https://www.youtube.com/watch?v=uiMuu-2lXeU
Steph Curry: Endorsing Harris was an &#39;easy choice&#39;,MS NOW,2024-09-06T21:03:48Z,https://www.youtube.com/watch?v=GUg6ilg2_V8
Harris&#39; facial expressions take center stage,MS NOW,2024-09-11T17:56:58Z,https://www.youtube.com/watch?v=yb4PyWnhOWE
Lawrence: The humanity gap between Kamala Harris and Donald Trump was on display today,MS NOW,2024-08-29T03:15:13Z,https://www.youtube.com/watch?v=PinFHOiOwXY
I’m sorry Ms. Jackson! Kamala Harris IS Black — not Indian and white like right-wing conspiracy,MS NOW,2024-09-24T03:37:31Z,https://www.youtube.com/watch?v=RHXrWsXeVhI
Lawrence reacts to Taylor Swift&#39;s endorsement of Kamala Harris,MS NOW,2024-09-12T02:36:45Z,https://www.youtube.com/watch?v=Ke3iqz1_8-4
Harris REBUKES false Springfield rhetoric,MS NOW,2024-09-17T23:04:37Z,https://www.youtube.com/watch?v=tJbxNHsI6t4
Dick Cheney voting for Kamala Harris,MS NOW,2024-09-06T20:12:48Z,https://www.youtube.com/watch?v=dJ9-VR8O_vw
How Harris baited Trump in the debate,MS NOW,2024-09-11T05:07:01Z,https://www.youtube.com/watch?v=ctMvUrviAMs
Doug Emhoff tells story of falling in love with Kamala Harris I Full DNC speech,MS NOW,2024-08-21T03:27:18Z,https://www.youtube.com/watch?v=WW6ygon9SuU
"Winfrey hosts emotional, star-studded virtual rally for Harris | Full event",MS NOW,2024-09-20T01:42:16Z,https://www.youtube.com/watch?v=84oC-KaaNv4
Harris makes SURPRISE appearance at DNC,MS NOW,2024-08-20T02:14:24Z,https://www.youtube.com/watch?v=jNRWWFDFRRQ
&#39;It&#39;s a big deal&#39;: MSNBC panel reacts to Taylor Swift&#39;s endorsement of Kamala Harris,MS NOW,2024-09-11T04:38:08Z,https://www.youtube.com/watch?v=tsQ0BXuKwnI
Kamala HQ calls Trump a chicken,MS NOW,2024-08-27T01:20:47Z,https://www.youtube.com/watch?v=s4IdtNTAVN4
Harris&#39; sister shares mother&#39;s journey and praises the vice president,MS NOW,2024-08-23T03:30:25Z,https://www.youtube.com/watch?v=Djs71zSzPPg
WATCH: Kamala Harris rallies in swing state Pennsylvania after Trump debate,MS NOW,2024-09-13T22:47:32Z,https://www.youtube.com/watch?v=egxGObeQ3oQ
WATCH: Harris rallies in NC after glowing debate performance,MS NOW,2024-09-12T20:19:38Z,https://www.youtube.com/watch?v=aCtsP25bYvM
Watch the first Trump-Harris presidential debate in 3 minutes,MS NOW,2024-09-11T04:45:47Z,https://www.youtube.com/watch?v=BVlI0vcf5T8
Harris and Trump release comically different ads,MS NOW,2024-08-28T00:47:38Z,https://www.youtube.com/watch?v=AZoK666MTv0
Taylor Swift endorses VP Kamala Harris,MS NOW,2024-09-11T10:16:31Z,https://www.youtube.com/watch?v=Pa2F6iz0MJw
Carole King &#39;OG cat lady&#39; for Kamala Harris,MS NOW,2024-08-15T03:15:02Z,https://www.youtube.com/watch?v=kJdcF-5DzCE
Lawrence: First D.C. Republican to fear Harris saw Trump’s ‘train wreck’ debate coming,MS NOW,2024-09-13T03:34:31Z,https://www.youtube.com/watch?v=SsaE_UDBmZY
Harris: Trump &#39;not serious&#39; about economic issues,MS NOW,2024-09-25T22:35:49Z,https://www.youtube.com/watch?v=ZmsaRvZ1KKk
"WATCH: Kamala Harris condemns Trump, focuses on reproductive rights at Georgia event",MS NOW,2024-09-20T19:47:29Z,https://www.youtube.com/watch?v=_msfsX0w6GI
Harris campaign: Every swing state will be &#39;very close&#39;,MS NOW,2024-09-13T04:40:11Z,https://www.youtube.com/watch?v=ec6EPfVgOHQ
&#39;It&#39;s the only way&#39;: More Republicans back Harris with goal of purging Trump to save the GOP ,MS NOW,2024-09-24T10:16:58Z,https://www.youtube.com/watch?v=j4zRrdFq20k
Harris delivers devastating blow to Trump at convention,MS NOW,2024-08-27T23:15:17Z,https://www.youtube.com/watch?v=bUKHHM9p0rk
Joy: &#39;Trump got destroyed in this debate&#39;,MS NOW,2024-09-11T06:41:42Z,https://www.youtube.com/watch?v=79KmVqdj9sI
Tim Walz&#39;s &#39;White Guy Tacos&#39;,MS NOW,2024-08-16T15:52:33Z,https://www.youtube.com/watch?v=UC8NFJBR0kQ
Lawrence: Trump ‘lost in the wilderness of his own confusion’ in debate with Harris,MS NOW,2024-09-12T03:50:42Z,https://www.youtube.com/watch?v=rWyESnUs-xk
"Rep. Crockett at DNC: &#39;Kamala Harris has a resume, Donald Trump has a rap sheet&#39;",MS NOW,2024-08-20T03:30:40Z,https://www.youtube.com/watch?v=xoK8C7fgQcY
‘Make or break’: Kamala Harris gets ready to take on Trump in debate,MS NOW,2024-09-07T01:21:48Z,https://www.youtube.com/watch?v=I1apUZjQHKU
Steve Kerr: &#39;Night night&#39; for Trump,MS NOW,2024-08-20T03:32:32Z,https://www.youtube.com/watch?v=Itl8PigZeo0
‘We do great things because we focus on the issues that are in the middle’: GOP Mayor on Harris,MS NOW,2024-08-20T17:46:53Z,https://www.youtube.com/watch?v=YjgDYD-JkMA
Harris to Gen Z: &#39;Your generation is killing it&#39;,MS NOW,2024-09-19T00:09:59Z,https://www.youtube.com/watch?v=2F1BRobtd9k
How America’s youngest congressman is helping Kamala Harris reach young voters,MS NOW,2024-08-31T16:36:14Z,https://www.youtube.com/watch?v=P9LSx97caRo
Joe Scarborough: Kamala Harris talked about the greatness of America,MS NOW,2024-08-23T21:25:07Z,https://www.youtube.com/watch?v=my4z4WXO57Q
Joe: Liz Cheney&#39;s endorsement of Kamala Harris is &#39;a vote for democracy&#39;,MS NOW,2024-09-05T22:51:05Z,https://www.youtube.com/watch?v=OhOxNJGEHfA
Trump makes excuses to get out of second debate,MS NOW,2024-09-22T21:29:19Z,https://www.youtube.com/watch?v=JucgYpQKIP0
‘We do great things because we focus on the issues that are in the middle’: GOP Mayor on Harris,MS NOW,2024-08-20T17:46:53Z,https://www.youtube.com/watch?v=YjgDYD-JkMA
How America’s youngest congressman is helping Kamala Harris reach young voters,MS NOW,2024-08-31T16:36:14Z,https://www.youtube.com/watch?v=P9LSx97caRo
Joe: Liz Cheney&#39;s endorsement of Kamala Harris is &#39;a vote for democracy&#39;,MS NOW,2024-09-05T22:51:05Z,https://www.youtube.com/watch?v=OhOxNJGEHfA
Joy: &#39;Trump got destroyed in this debate&#39;,MS NOW,2024-09-11T06:41:42Z,https://www.youtube.com/watch?v=79KmVqdj9sI
&#39;It&#39;s a big deal&#39;: MSNBC panel reacts to Taylor Swift&#39;s endorsement of Kamala Harris,MS NOW,2024-09-11T04:38:08Z,https://www.youtube.com/watch?v=tsQ0BXuKwnI
Countdown to the 2024 election: Day 68 | MSNBC Highlights,MS NOW,2024-08-29T06:40:29Z,https://www.youtube.com/watch?v=RVpv7XH8JeI
Fmr. Senator Barbara Boxer ‘very impressed’ with Kamala Harris on the campaign trail,MS NOW,2024-08-21T21:05:21Z,https://www.youtube.com/watch?v=vsnq0c-eGN8
Harris to Gen Z: &#39;Your generation is killing it&#39;,MS NOW,2024-09-19T00:09:59Z,https://www.youtube.com/watch?v=2F1BRobtd9k
Ari Melber interviews Kamala Harris at PA Prison Town Hall in 2019 (Full panel),MS NOW,2024-08-27T17:10:28Z,https://www.youtube.com/watch?v=3eStKoBiZyI
Joe Scarborough: Kamala Harris talked about the greatness of America,MS NOW,2024-08-23T21:25:07Z,https://www.youtube.com/watch?v=my4z4WXO57Q
Close polls belie contrary trends as Kamala Harris continues to strengthen and Trump struggles,MS NOW,2024-08-31T04:15:00Z,https://www.youtube.com/watch?v=GKoLZWpJdD4
‘Never Trumpers’ line up to support Vice President Kamala Harris in 2024 election,MS NOW,2024-08-12T20:54:57Z,https://www.youtube.com/watch?v=iFEiLiLU1qs
Harris: I promise to be a president for all Americans,MS NOW,2024-08-23T05:37:08Z,https://www.youtube.com/watch?v=mDj68o_Ti-k
Trump makes excuses to get out of second debate,MS NOW,2024-09-22T21:29:19Z,https://www.youtube.com/watch?v=JucgYpQKIP0
New poll shows Harris with a lead greater than margin of error against Trump,MS NOW,2024-09-16T19:03:05Z,https://www.youtube.com/watch?v=GKyBD6nETNo
They have to get him to be Trump: How Harris may approach tonight&#39;s debate,MS NOW,2024-09-10T10:51:15Z,https://www.youtube.com/watch?v=SadX2cPnQ0U
"Eugene Robinson: Harris is asking Americans to vote on her merits, not her identity",MS NOW,2024-08-30T19:33:04Z,https://www.youtube.com/watch?v=JqyqkJmqYhc
Harris’ future economic policies need ‘enough meat on the bones’ for voters before DNC: Tim Miller,MS NOW,2024-08-14T18:14:05Z,https://www.youtube.com/watch?v=kGudjXvaPp0
Joy: &#39;Democrats are refreshed and excited&#39;,MS NOW,2024-08-20T01:00:16Z,https://www.youtube.com/watch?v=XGaByBC-wrA
"&#39;Total badass!&#39; Whitmer says Kamala Harris is ‘tough&#39;, ‘tested’ and ready to lead I Full DNC Speech",MS NOW,2024-08-23T02:50:12Z,https://www.youtube.com/watch?v=BGoIQnmvYaU
&#39;Star power&#39;: Stacey Abrams tells MSNBC how Kamala Harris can win Georgia,MS NOW,2024-08-22T23:31:59Z,https://www.youtube.com/watch?v=t6WAIaOQ7-o
John Heilemann: &#39;Kamala Harris&#39; family looks like America today&#39;,MS NOW,2024-08-21T18:17:57Z,https://www.youtube.com/watch?v=QNNiqBWRvMA
‘We are the underdog’: VP Kamala Harris holds massive rally in battleground North Carolina,MS NOW,2024-09-12T21:00:38Z,https://www.youtube.com/watch?v=2O0a60SvKOA
&quot;We know you&#39;re lying&quot;: Undecided voter&#39;s emotional response to Trump,MS NOW,2024-09-11T20:34:54Z,https://www.youtube.com/watch?v=SbEc0MpCCc0
Harris-Walz battleground director lays out campaign strategy with just 53 days left before election,MS NOW,2024-09-13T21:49:08Z,https://www.youtube.com/watch?v=vfj2QElPdiQ
Harris spending time in &#39;Trump country&#39; areas of Pennsylvania to expand her appeal,MS NOW,2024-09-13T15:36:30Z,https://www.youtube.com/watch?v=lWvbCOqAgSg
"Ella Emhoff, Meena Harris and Helena Hudlin praise Harris",MS NOW,2024-08-23T06:30:19Z,https://www.youtube.com/watch?v=uTi_-VS_7hE
Michael Steele on the Harris-Trump debate,MS NOW,2024-09-10T17:48:57Z,https://www.youtube.com/watch?v=N_CXVkHGGPU
&#39;An emotional and chilling ride:&#39; Harris’ high school friend on watching her win the Dem nomination,MS NOW,2024-08-22T15:06:36Z,https://www.youtube.com/watch?v=gotrNf2MNfo
"Trump outshined: Harris-Oprah event stuns with Meryl, Stiller &amp; Chris Rock",MS NOW,2024-09-20T23:35:16Z,https://www.youtube.com/watch?v=taUczSqyTIA
Who is Kamala Harris? Both Harris and Trump campaigns trying to define her using ads,MS NOW,2024-08-27T18:26:01Z,https://www.youtube.com/watch?v=lCCYc9p4Syg
"Mika Brzezinski: Harris &#39;elegant and classy,&#39; as Trump &#39;lost it&#39; at debate",MS NOW,2024-09-11T14:50:44Z,https://www.youtube.com/watch?v=oA9fShH_m60
&#39;No morals&#39;: See Trump WH staffer spill secrets and back Kamala Harris at DNC,MS NOW,2024-08-21T00:08:55Z,https://www.youtube.com/watch?v=eETyxYO85_A
Patriotic defectors: Top Republicans dump Trump for Harris-Walz,MS NOW,2024-08-27T03:10:14Z,https://www.youtube.com/watch?v=QtUpngHcDQ0
John Heilemann: Kamala Harris commanded the debate,MS NOW,2024-09-11T11:52:24Z,https://www.youtube.com/watch?v=WpSSwKbN25g
MAGA Panic! See news break as Taylor Swift backs Harris amidst Trump debate loss,MS NOW,2024-09-11T22:14:26Z,https://www.youtube.com/watch?v=88vHFK8sCJA
&#39;Trump got destroyed&#39;: See Maddow and MSNBC panel instantly react to historic debate,MS NOW,2024-09-11T04:20:11Z,https://www.youtube.com/watch?v=SpRtNilzLSc
Kamala Harris nomination boosted by Black women strategists who call themselves &#39;the colored girls&#39;,MS NOW,2024-09-03T23:30:13Z,https://www.youtube.com/watch?v=tNhOcrFIyX8
Dick Cheney voting for Harris &#39;signals&#39; to others that &#39;it&#39;s okay&#39; to vote for the VP,MS NOW,2024-09-06T20:53:31Z,https://www.youtube.com/watch?v=Xg-04yVa48o
Voters ditching Trump for &#39;younger&#39; Harris? See Comic D.L. Hughley absolutely roast Trump on TV,MS NOW,2024-09-03T23:56:05Z,https://www.youtube.com/watch?v=1jOvJ53LNqk
Harris didn&#39;t treat Trump like the &#39;main character&#39;,MS NOW,2024-09-12T02:49:16Z,https://www.youtube.com/watch?v=nlzIcQk63iI
"Can Harris win Georgia? &#39;Absolutely&#39; she can, says campaign adviser",MS NOW,2024-08-28T16:21:26Z,https://www.youtube.com/watch?v=y9IL4QJAv7o
Arizona Republican lawmaker: ‘The best candidate in this race is Kamala Harris’,MS NOW,2024-08-21T00:05:49Z,https://www.youtube.com/watch?v=CjPwaHL6Hmo
Kamala Harris blames Donald Trump for abortion bans,MS NOW,2024-09-21T04:30:16Z,https://www.youtube.com/watch?v=lEqWlkS6CbQ
‘He is proud that women are dying?’: Harris blasts Trump for deadly Georgia abortion ban,MS NOW,2024-09-21T03:46:09Z,https://www.youtube.com/watch?v=ueae4Bb8tjk
Sen. Gary Peters on Kamala Harris: &#39;We can back her up in the senate with a clear majority&#39;,MS NOW,2024-08-12T00:18:07Z,https://www.youtube.com/watch?v=1EXXruxVifk
"SEE HISTORY: Kamala Harris nominated in music-themed, energetic roll call vote at DNC",MS NOW,2024-08-21T03:07:24Z,https://www.youtube.com/watch?v=ownQeuOjBz0
A transformed race: Harris builds momentum in latest polling,MS NOW,2024-09-23T10:53:08Z,https://www.youtube.com/watch?v=J4tSgulM9tA
&#39;A big problem for Republicans&#39;: High favorability moves Harris-Walz ahead,MS NOW,2024-09-19T05:15:09Z,https://www.youtube.com/watch?v=xNmByD-aqyc
Trump panics! Harris nabs Taylor Swift backing as she blasts MAGA lies &amp; &#39;chaos&#39; (Melber report),MS NOW,2024-09-11T23:42:22Z,https://www.youtube.com/watch?v=Lw0ngqRD0z8
Steve Kerr: &#39;Night night&#39; for Trump,MS NOW,2024-08-20T03:32:32Z,https://www.youtube.com/watch?v=Itl8PigZeo0
"Mika Brzezinski: Harris &#39;elegant and classy,&#39; as Trump &#39;lost it&#39; at debate",MS NOW,2024-09-11T14:50:44Z,https://www.youtube.com/watch?v=oA9fShH_m60
&#39;He has shrunk&#39;: Kamala Harris finds antidote to Donald Trump&#39;s negativity,MS NOW,2024-08-14T04:00:27Z,https://www.youtube.com/watch?v=RFbb_Z5XqEI
SEE HISTORY: Kamala Harris accepts nomination for president at DNC I Full Speech,MS NOW,2024-08-23T06:04:24Z,https://www.youtube.com/watch?v=xiDlddyaw_M
Harris slams Trump: Dictators are &quot;rooting&quot; for him,MS NOW,2024-08-23T13:40:09Z,https://www.youtube.com/watch?v=5MrzIo5i79g
Trump silenced? How Harris is riding Billie Eilish &amp; Swiftie momentum: Melber Breakdown,MS NOW,2024-09-18T00:00:28Z,https://www.youtube.com/watch?v=jg-2mKOXKuk
"&#39;Dangerous, divisive, terrifying&#39;: Harris to highlight dangers of a &#39;Trump 2.0 presidency&#39;",MS NOW,2024-09-09T18:40:59Z,https://www.youtube.com/watch?v=1u60VFbOEP4
&#39;Kamala Harris is more than ready for this moment&#39;: Michelle Obama endorses VP at DNC,MS NOW,2024-08-21T04:17:40Z,https://www.youtube.com/watch?v=v8HDbVkHvtM
Joy Reid: Kamala Harris&#39; nomination is &#39;a moment for Alpha Kappa Alpha Sorority&#39;,MS NOW,2024-08-22T22:53:46Z,https://www.youtube.com/watch?v=H7NHWRDA4ww
&quot;We know you&#39;re lying&quot;: Undecided voter&#39;s emotional response to Trump,MS NOW,2024-09-11T20:34:54Z,https://www.youtube.com/watch?v=SbEc0MpCCc0
Former Attorney General Alberto Gonzales to support Kamala Harris,MS NOW,2024-09-12T12:35:19Z,https://www.youtube.com/watch?v=iTjKS0Tk1RI
Harris needs to &#39;introduce herself&#39; and &#39;make the case&#39; with Latino voters,MS NOW,2024-08-30T18:26:00Z,https://www.youtube.com/watch?v=yxe3Or0kmy0
What are the possible ‘speed bumps’ for the Harris campaign?,MS NOW,2024-08-12T20:38:09Z,https://www.youtube.com/watch?v=KQS_tySrCqg
Harris leads Trump by 27 points among eligible Latinos in new polling,MS NOW,2024-09-04T13:02:08Z,https://www.youtube.com/watch?v=vRrZbeemNFw
Trump makes excuses to get out of second debate,MS NOW,2024-09-22T21:29:19Z,https://www.youtube.com/watch?v=JucgYpQKIP0
Harris spin room surrogates to include ‘surprise guest’,MS NOW,2024-09-11T00:26:15Z,https://www.youtube.com/watch?v=bL9xw0T2u-E
"&#39;Big, happy family&#39;: Kamala Harris&#39; acceptance speech meets ecstatic reception at DNC",MS NOW,2024-08-23T06:20:22Z,https://www.youtube.com/watch?v=cZX6wPTa0T4
"Kamala Harris speaks at campaign rally in Madison, WI",MS NOW,2024-09-21T00:47:05Z,https://www.youtube.com/watch?v=QPgWgh3jwUI
Why Trump is rattled and &#39;off&#39; campaign trail: See Kamala Harris rally in PA with Biden,MS NOW,2024-09-03T19:31:59Z,https://www.youtube.com/watch?v=39DlgeLXXAM
Harris says she&#39;s going to &#39;earn the vote&#39; of Black men,MS NOW,2024-09-18T10:50:13Z,https://www.youtube.com/watch?v=UEdN4sqV5Wg
Harris: Trump only intends to improve life for &#39;people like himself&#39;,MS NOW,2024-09-25T21:15:41Z,https://www.youtube.com/watch?v=Ev-YQjyXekQ
Rep. Horsford sets record straight after Trump calls Harris a &#39;copycat&#39; over ‘no tax on tips’ plan,MS NOW,2024-08-25T17:39:38Z,https://www.youtube.com/watch?v=liFS6WP3hAE
Debate double standard: Media &#39;sane-washing&#39; Trump means Harris must be &#39;twice as good&#39;,MS NOW,2024-09-10T03:08:37Z,https://www.youtube.com/watch?v=MXXNybD86yY
"Trump is ‘too scared’ to agree to a second debate with Harris, but he should: Rep. Garcia",MS NOW,2024-09-21T19:57:15Z,https://www.youtube.com/watch?v=pAYYg5E5lD8
&#39;Let Trump be Trump&#39;: What Harris needs to say in the debate to make her case,MS NOW,2024-09-09T15:38:55Z,https://www.youtube.com/watch?v=2prmX2XM6zk
Joy: Harris crowd sizes are &#39;breaking Trump&#39;s brain&#39;,MS NOW,2024-08-14T04:37:51Z,https://www.youtube.com/watch?v=xlbNESif504
Taylor Swift endorsed Kamala Harris. Is the 2024 election ready for it?,MS NOW,2024-09-15T17:18:04Z,https://www.youtube.com/watch?v=dPvtXo3bexk
Joy: &#39;Trump got destroyed in this debate&#39;,MS NOW,2024-09-11T06:41:42Z,https://www.youtube.com/watch?v=79KmVqdj9sI
"Comparison with Harris economic plan exposes Trump tax hike on middle class, favors for ultra rich",MS NOW,2024-08-28T05:19:54Z,https://www.youtube.com/watch?v=8GCWhWP4hc4
‘There will be no third debate’: Donald Trump bails on an additional debate with VP Kamala Harris,MS NOW,2024-09-12T21:40:37Z,https://www.youtube.com/watch?v=eF0pbaeBeOY
How Kamala Harris is rallying key states as voting begins: Dem Party leaders weigh in,MS NOW,2024-09-21T16:51:51Z,https://www.youtube.com/watch?v=f_Nw68sNSK4
Historic: Kamala Harris barnstorms rural Georgia in first Dem blitz since &#39;92,MS NOW,2024-08-30T04:26:16Z,https://www.youtube.com/watch?v=SyFJX9MYC9w
Will Taylor Swift endorse Kamala Harris? Here’s what a campaign advisor had to say,MS NOW,2024-09-06T19:31:52Z,https://www.youtube.com/watch?v=rzRGiP-bzmo
Joy: ‘Kamala Harris has to nail’ debate to ‘put Trumpism into the dustbin of history’,MS NOW,2024-09-10T03:22:48Z,https://www.youtube.com/watch?v=f_SUQXEGnZI
Maddow on Trump spinning &#39;on his own behalf&#39; after debate,MS NOW,2024-09-11T05:26:01Z,https://www.youtube.com/watch?v=puRNfpohuUc
700+ nat&#39;l security and military leaders endorse Harris,MS NOW,2024-09-23T10:12:52Z,https://www.youtube.com/watch?v=WT3Pk9iEx-8
More than a dozen Reagan alumni endorse Kamala Harris,MS NOW,2024-09-16T12:47:33Z,https://www.youtube.com/watch?v=WWZQPrD_trI
"Trump spews &#39;division and hate,&#39; Harris &#39;sees and hears everyone&#39;: Sen. Laphonza Butler",MS NOW,2024-08-18T18:03:01Z,https://www.youtube.com/watch?v=W1kRiKxcOf0
WATCH: Harris rallies in North Carolina as Trump campaign feels heat,MS NOW,2024-08-16T19:01:41Z,https://www.youtube.com/watch?v=kDI4HEAF9Nk
Growing number of former senior military officials endorsing VP Kamala Harris for President,MS NOW,2024-09-17T21:33:16Z,https://www.youtube.com/watch?v=1pGj2meezsA
&#39;She can go to hell&#39;: Vance slams Harris over Afghanistan withdrawal,MS NOW,2024-08-29T10:47:39Z,https://www.youtube.com/watch?v=nMecEBxAD-Y
Divine intervention? Evangelicals once &#39;hijacked by MAGA’ flock to Harris-Walz ticket,MS NOW,2024-08-15T03:30:16Z,https://www.youtube.com/watch?v=XUttoCE0PVY
Live mics &#39;absolutely&#39; preference of Harris campaign during debate,MS NOW,2024-08-26T16:24:11Z,https://www.youtube.com/watch?v=qcw7UtYBvJg
Historic outreach: Harris-Walz Campaign&#39;s $3M push to engage Latino voters,MS NOW,2024-09-22T16:01:31Z,https://www.youtube.com/watch?v=gj9-QXI0n18
&#39;The president of joy&#39;: Bill Clinton says ‘We need Kamala Harris’ as POTUS I Full DNC Speech,MS NOW,2024-08-22T02:55:10Z,https://www.youtube.com/watch?v=AxuA4vJqa9o
WATCH: Harris rallies in Milwaukee amid high energy DNC in Chicago,MS NOW,2024-08-21T01:43:52Z,https://www.youtube.com/watch?v=EpzB_VmXiZU
‘Palpable enthusiasm’: Harris picks up steam in battleground states,MS NOW,2024-08-14T01:06:30Z,https://www.youtube.com/watch?v=MnyVsgL4gck
Harris-Walz Senior Campaign Advisor emphasize a &#39;Donald Trump 2.0&#39; is far more dangerous if elected,MS NOW,2024-09-07T22:37:06Z,https://www.youtube.com/watch?v=ZdmHoWT9aUE
Harris-Walz campaign aide: Biden put his money where his mouth is,MS NOW,2024-09-05T01:31:52Z,https://www.youtube.com/watch?v=8zjXX4OGGSc
"‘¡Sí, se puede!’: Latino voter enthusiasm for Harris skyrockets over issues like housing",MS NOW,2024-08-31T03:15:04Z,https://www.youtube.com/watch?v=ojV2CVC67Xo
Joe calls out Trump for being &#39;ill equipped to talk about policy&#39; ahead of debate,MS NOW,2024-09-10T17:24:39Z,https://www.youtube.com/watch?v=KLOIY9gKmps
D.L. Hughley delivers speech at DNC,MS NOW,2024-08-23T19:40:48Z,https://www.youtube.com/watch?v=6ZsM4iPUQZI
Rep. Horsford sets record straight after Trump calls Harris a &#39;copycat&#39; over ‘no tax on tips’ plan,MS NOW,2024-08-25T17:39:38Z,https://www.youtube.com/watch?v=liFS6WP3hAE
"Harris team thinks if they can goad Trump back on debate stage, Harris can win again: Hugo Lowell",MS NOW,2024-09-21T19:56:29Z,https://www.youtube.com/watch?v=XC-wl_l9e3E
Sen. Booker reacts to Harris-Trump debate: ‘She exposed him raw’,MS NOW,2024-09-12T01:28:25Z,https://www.youtube.com/watch?v=jjuNBnHu3Bk
&#39;She put a bully in his place&#39;: Gov. Tim Walz celebrates Kamala Harris debate performance ,MS NOW,2024-09-11T06:20:17Z,https://www.youtube.com/watch?v=9qxlk_vE4UY
"Trump is ‘too scared’ to agree to a second debate with Harris, but he should: Rep. Garcia",MS NOW,2024-09-21T19:57:15Z,https://www.youtube.com/watch?v=pAYYg5E5lD8
Divine intervention? Evangelicals once &#39;hijacked by MAGA’ flock to Harris-Walz ticket,MS NOW,2024-08-15T03:30:16Z,https://www.youtube.com/watch?v=XUttoCE0PVY
Trump doesn’t know how to deal with ‘political earthquake’ of Kamala Harris candidacy,MS NOW,2024-08-15T22:00:03Z,https://www.youtube.com/watch?v=4cnR75MVgoU
Mary Trump: VP Harris inflicted a ‘narcissistic wound’ on Trump he may never recover from,MS NOW,2024-09-13T01:46:18Z,https://www.youtube.com/watch?v=7x6ficl5MJM
&#39;He has shrunk&#39;: Kamala Harris finds antidote to Donald Trump&#39;s negativity,MS NOW,2024-08-14T04:00:27Z,https://www.youtube.com/watch?v=RFbb_Z5XqEI
Carole King sings surprise song on Swifties for Kamala Zoom,MS NOW,2024-08-28T15:14:47Z,https://www.youtube.com/watch?v=9m4AgtR0ZpM
WATCH: Harris rallies in North Carolina as Trump campaign feels heat,MS NOW,2024-08-16T19:01:41Z,https://www.youtube.com/watch?v=kDI4HEAF9Nk
Kamala Harris breaks 30-year hiatus in historic Savannah campaign stop,MS NOW,2024-08-31T16:37:26Z,https://www.youtube.com/watch?v=krawGzotZ0A
Mission critical: Harris&#39; Palestinian American outreach,MS NOW,2024-09-04T20:55:21Z,https://www.youtube.com/watch?v=IV3oDRTlwA8
Sen. Warren on Trump: &#39;The felon is afraid of the prosecutor&#39;,MS NOW,2024-08-27T13:51:03Z,https://www.youtube.com/watch?v=k4Fb2sq4vKI
Top Dem raps DNC battle plan,MS NOW,2024-08-22T08:14:16Z,https://www.youtube.com/watch?v=ZLXje0iBkKc
Tim Walz reacts to Taylor Swift&#39;s endorsement,MS NOW,2024-09-11T04:52:42Z,https://www.youtube.com/watch?v=2KTv7q5BB6w
Harris slams Trump: Dictators are &quot;rooting&quot; for him,MS NOW,2024-08-23T13:40:09Z,https://www.youtube.com/watch?v=5MrzIo5i79g
Trump&#39;s 2024 nightmare: Women voting surge could elect Harris,MS NOW,2024-09-02T22:45:00Z,https://www.youtube.com/watch?v=ABnRCH0-X1c
‘She ate him for lunch’: Donald Trump rattled by VP Harris as even Fox News blast his performance,MS NOW,2024-09-11T20:49:41Z,https://www.youtube.com/watch?v=_EjkJ6_8qu8
Rattled: Trump runs from Project 2025 as Harris turns up the heat,MS NOW,2024-09-06T00:31:50Z,https://www.youtube.com/watch?v=Rlmi5hn8n8E
SEE HISTORY: Kamala Harris accepts nomination for president at DNC I Full Speech,MS NOW,2024-08-23T06:04:24Z,https://www.youtube.com/watch?v=xiDlddyaw_M
To DEBATE or not?,MS NOW,2024-08-26T19:59:32Z,https://www.youtube.com/watch?v=0tuSGo3xd7o
&#39;Prosecute this man&#39;: What Harris needs to do in debate against Trump next week,MS NOW,2024-09-03T16:19:03Z,https://www.youtube.com/watch?v=EQVIQ7Kq0S8
Kornacki breaks down the latest polling as Harris and Trump brace for final sprint,MS NOW,2024-09-03T19:26:34Z,https://www.youtube.com/watch?v=3h7hrVKrIXY
